{
  "schema_version": "1.0.0",
  "review_id": "REVIEW-000002",
  "review_type": "IMPLEMENTATION_REREVIEW",
  "approval_scope": "REPOSITORY_IMPLEMENTATION_AND_ARTIFACTS",
  "subject": {
    "pull_request_url": "https://github.com/chefmrfrizzle/TheCubedz/pull/6",
    "head_commit": "4b2e24d445f9cacd08cd85cc1a35350951a1553f",
    "passport_id": "PASSPORT-000002",
    "passport_version": "1.0.1",
    "candidate_id": "CANDIDATE-000002",
    "prior_review_id": "REVIEW-000001",
    "result_digest": "sha256:73af7803b5ae10a9f8b1269398a126e6da94072b30a7e12da16f3e8f53e012d2"
  },
  "outcome": "APPROVED",
  "recorded_at": "2026-08-09T00:34:40Z",
  "reviewer": {
    "identity": "independent reviewer; identity not recorded in the supplied re-review",
    "identity_status": "UNRECORDED_IN_SUPPLIED_REVIEW",
    "independence_scope": "INDEPENDENT_REPOSITORY_VERIFICATION"
  },
  "verified_items": [
    {
      "item_id": "VERIFICATION-01",
      "statement": "Candidate 000002 matches every expected field in PASSPORT-000002 version 1.0.1, including the complete Jacobian and derived results.",
      "evidence_paths": ["candidates/CANDIDATE-000002.json", "benchmarks/BENCHMARK-000002.passport.json", "artifacts/results/CANDIDATE-000002.result.json"]
    },
    {
      "item_id": "VERIFICATION-02",
      "statement": "The published non-diagonal Jacobian counterexample fails the exact Jacobian check in both implemented arithmetic paths.",
      "evidence_paths": ["src/research_core/pipeline.py", "independent/linear_coordinate_crosscheck.py", "tests/test_science_pipeline.py", "tests/test_linear_coordinate_crosscheck.py"]
    },
    {
      "item_id": "VERIFICATION-03",
      "statement": "An invalid nested coordinate relation is rejected by the primary Draft 2020-12 candidate-schema validator.",
      "evidence_paths": ["src/research_core/schema_validation.py", "src/core/candidate.schema.json", "tests/test_science_pipeline.py"]
    },
    {
      "item_id": "VERIFICATION-04",
      "statement": "Both secondary records exclude schema conformance and disclose their exact 11-of-12 and 13-of-14 comparison scopes.",
      "evidence_paths": ["artifacts/reproductions/CANDIDATE-000001.crosscheck.json", "artifacts/reproductions/CANDIDATE-000002.crosscheck.json"]
    },
    {
      "item_id": "VERIFICATION-05",
      "statement": "All seven recorded source paths are byte-identical to their blobs at source commit 038b8e3a9d7f46a1f3091bcc76c4df91c2375112.",
      "evidence_paths": ["scripts/test_repository.mjs", "artifacts/results/CANDIDATE-000002.result.json"]
    },
    {
      "item_id": "VERIFICATION-06",
      "statement": "Candidate 000001 regenerates its frozen scientific digest.",
      "evidence_paths": ["artifacts/results/CANDIDATE-000001.result.json"]
    },
    {
      "item_id": "VERIFICATION-07",
      "statement": "Candidate 000002 regenerates its published scientific digest.",
      "evidence_paths": ["artifacts/results/CANDIDATE-000002.result.json"]
    }
  ],
  "remaining_objections": [],
  "boundaries": {
    "external_scientific_reproduction": false,
    "novel_physics_claim": false,
    "transportation_claim": false
  },
  "provenance": {
    "supplied_by": "ChefMrFrizzle",
    "recorded_by": "ChefMrFrizzle with Codex",
    "source_description": "Approval response supplied after independent verification of PR 6 at the recorded head commit.",
    "license": "Apache-2.0"
  }
}
